{"uid":"krok-file-2-q035","verifiedAt":"2026-05-20T00:00:00Z","verifiedBy":"claude-opus-4-7","independentChoice":{"key":"c","text":"Надати пацієнту положення сидячи та повідомити лікаря","confidence":"high","reasoning":"Клінічна картина — класична автономна дисрефлексія у пацієнта зі СМТ на рівні Т5 (вище Т6): раптовий стрибок АТ 185/100, пульсуючий головний біль, почервоніння обличчя, пітливість, розпливчастість зору. Згідно з протоколом Consortium for Spinal Cord Medicine та ISCoS, перший крок невідкладної допомоги — посадити пацієнта вертикально з опущеними ногами для ортостатичного зниження АТ, далі — розслабити тісний одяг, шукати й усунути тригер (переповнений сечовий міхур/кишківник), викликати лікаря. Горизонтальне положення і компресія ніг/живота протипоказані, бо підвищують АТ."},"crossCheck":{"perSource":[{"file":"krok-file-2","qId":"krok-file-2-q035","claimedKey":"c","agrees":true,"verdict":"correct","reason":"Джерело правильно ідентифікує автономну дисрефлексію і обирає посадження як перший крок протоколу; прапор needsReview виглядає надлишковим — клінічної суперечності немає."},{"file":"krok-file-3","qId":"krok-file-3-q035","claimedKey":"c","agrees":true,"verdict":"correct","reason":"Повністю відповідає протоколу домедичної допомоги при автономній дисрефлексії у СМТ вище Т6."}]},"finalAnswer":{"key":"c","text":"Надати пацієнту положення сидячи та повідомити лікаря","confidence":"high","reasoning":"Це класичний випадок автономної дисрефлексії при СМТ ≥ Т6: тріада гіпертензія + пульсуючий головний біль + вегетативні симптоми вище рівня травми. Стандарт ISCoS / Consortium for Spinal Cord Medicine визначає першу дію як вертикалізацію (sit up, legs down) для ортостатичного зниження АТ перед пошуком тригера й викликом лікаря. Обидва джерела згодні; розбіжностей по суті немає. Прапор needsReview у krok-file-2 виглядає технічним артефактом — клінічно валідація погоджується з PDF.","agreeingSources":["krok-file-2","krok-file-3"],"disagreeingSources":[]},"bestWhys":{"a":{"source":"krok-file-3","angle":"contrast","text":"На відміну від переведення в сидяче положення, яке через ортостаз одразу знижує тиск, дихальна гімнастика діє повільно й опосередковано. Це втрата критичних хвилин при цифрах АТ 185/100.","reason":"Найточніше показує часовий і механістичний програш дихання проти посадження при АТ-кризі."},"b":{"source":"krok-file-3","angle":"contrast","text":"Сидяче положення використовує гравітацію для зменшення венозного повернення і швидко опускає АТ; провітрювання — це загальний захід без точкового ефекту на гіпертензію.","reason":"Прямо протиставляє таргетний гемодинамічний ефект посадження загальному заходу."},"c":{"source":"krok-file-3","angle":"mnemonic","text":"Орієнтир: червоніє вище травми, тиск злітає — піднімай голову, опускай ноги; при автономній дисрефлексії «сідай і шукай тригер».","reason":"Найкомпактніша мнемоніка з порядком дій протоколу — легко відтворити біля пацієнта."},"d":{"source":"krok-file-3","angle":"mechanism","text":"Підняття ніг чи горизонтальне положення збільшують переднавантаження і церебральний кровоток, посилюючи гіпертензію та ризик внутрішньомозкового крововиливу при цифрах 185/100.","reason":"Найчіткіше пояснює патофізіологічну шкідливість горизонтального положення саме при цьому АТ."},"e":{"source":"krok-file-3","angle":"mechanism","text":"Компресія нижніх кінцівок і живота зменшує депонування крові внизу, збільшує переднавантаження і ще більше підвищує системний тиск, поглиблюючи неконтрольовану симпатичну відповідь.","reason":"Найчіткіше показує патогенетичну шкідливість компресії при гіпертензивному кризі."}},"bestHint":{"source":"krok-file-3","angle":"framework","text":"Згадай протокол домедичної допомоги при автономній дисрефлексії: спершу — положення, потім — пошук тригера, потім — лікар.","reason":"Називає синдром і структуру протоколу, не розкриваючи конкретної першої дії."},"notes":"Обидва джерела клінічно сходяться; needsReview у krok-file-2 виглядає технічним артефактом — клінічної суперечності з PDF немає."}