{"uid":"krok-file-2-q088","verifiedAt":"2026-05-20T00:00:00Z","verifiedBy":"claude-opus-4-7","independentChoice":{"key":"d","text":"Переміщення в різних напрямках в положенні сидячи з опорою на руки","confidence":"high","reasoning":"При повній параплегії на рівні Th6 збережені м'язи верхніх кінцівок і верхньогрудний відділ тулуба, тоді як нижні кінцівки й нижні відділи тулуба денервовані. Самостійний wheelchair transfer у такого пацієнта виконується технікою push-up/lateral shift з опорою на руки, тому першочергово тренується саме динамічний сидячий контроль з опорою на верхні кінцівки. Це відповідає класичній послідовності реабілітації СМТ (Somers, PT Management of SCI): статичний баланс сидячи → динаміка з опорою на руки → динаміка без опори → transfer."},"crossCheck":{"perSource":[{"file":"krok-file-2","qId":"krok-file-2-q088","claimedKey":"d","agrees":true,"verdict":"correct","reason":"Джерело правильно ідентифікує d як відповідь: динамічний рух тулубом з опорою на збережені руки безпосередньо моделює transfer-рух при Th6-параплегії. Прапор needsReview виглядає помилковим — клінічна логіка джерела узгоджена з еталоном."},{"file":"krok-file-3","qId":"krok-file-3-q088","claimedKey":"d","agrees":true,"verdict":"correct","reason":"Джерело правильно обирає d і дає коректне обґрунтування через механіку «руки тримають — таз їде» та послідовність формування навичок при СМТ."}]},"finalAnswer":{"key":"d","text":"Переміщення в різних напрямках в положенні сидячи з опорою на руки","confidence":"high","reasoning":"Обидва джерела збігаються з незалежним клінічним рішенням: при повній параплегії Th6 зі збереженими руками першочерговою навичкою для самостійного пересаджування у крісло колісне є динамічне переміщення сидячи з опорою на верхні кінцівки. Це безпосередньо моделює механіку transfer (push-up, lateral shift). Інші варіанти або біомеханічно неможливі (опора на паралізовані ноги), або належать до іншої мети (вертикалізація — профілактика ускладнень знерухомлення), або є навичками пізнішого етапу (баланс/нахили без опори на руки). Прапор needsReview у джерелі krok-file-2 був хибним: клінічної розбіжності з еталоном немає.","agreeingSources":["krok-file-2","krok-file-3"],"disagreeingSources":[]},"bestWhys":{"a":{"source":"krok-file-3","angle":"mechanism","text":"Самостійний трансфер у параплегіка реалізується силою рук і відриванням таза, а не опорою на ноги; відсутня іннервація нижче Th6 робить перенесення ваги на ноги біомеханічно неможливим.","reason":"Найточніше пояснює саме біомеханічну неможливість, апелюючи до конкретного рівня травми й механізму трансферу."},"b":{"source":"krok-file-3","angle":"contrast","text":"На відміну від динамічних переміщень сидячи з опорою на руки, статична вертикалізація не тренує контроль таза й перенесення ваги — ключові компоненти безпечного трансферу.","reason":"Прямо контрастує з правильним варіантом d і показує, чому статична поза не моделює рух пересаджування."},"c":{"source":"krok-file-3","angle":"contrast","text":"Самостійний трансфер виконується саме з опорою на руки, тому тренування без опори логічно йде пізніше, після опанування переміщень з опорою.","reason":"Найчіткіше відповідає на питання «чому не c, а d» через послідовність навичок та опору на руки."},"d":{"source":"krok-file-3","angle":"mnemonic","text":"Орієнтир: трансфер у параплегіка = «руки тримають, таз їде»; спершу вчимо рухатись сидячи з опорою на руки, потім — без опори.","reason":"Поєднує механізм transfer і чітку послідовність навичок — найбільш запам'ятовуване правило, що пояснює першочерговість саме d."},"e":{"source":"krok-file-3","angle":"contrast","text":"На відміну від переміщень сидячи з опорою на руки, утримання балансу без опори не тренує сам рух трансферу; його доцільно вводити пізніше, у поєднанні з активностями рук.","reason":"Найрізкіше відмежовує статичний баланс без рук від динамічного transfer-руху з опорою."}},"bestHint":{"source":"krok-file-3","angle":"framework","text":"Згадай послідовність формування сидячого балансу й трансферу при СМТ: статичний баланс → динаміка з опорою на руки → динаміка без опори.","reason":"Дає переносну рамку етапності навичок при СМТ, що однозначно скеровує на «динаміку з опорою» як першочерговий крок, не називаючи відповіді."},"notes":"Обидва джерела дають key=d. Прапор needsReview у krok-file-2 виглядає хибно встановленим — клінічної розбіжності з еталоном немає, його можна зняти."}