{
  "uid": "krok-file-2-q044",
  "verifiedAt": "2026-05-20T00:00:00Z",
  "verifiedBy": "claude-opus-4-7",
  "independentChoice": {
    "key": "c",
    "text": "Жорсткий протез стопи",
    "confidence": "high",
    "reasoning": "Дефект «підйом на носок» у фазі опори трансфеморального протеза класично описують у класифікаціях протезної ходи (Northwestern, ISPO) як наслідок порушення перекату «п'ята–носок»: жорсткий кіль/щиколотковий вузол (напр., SACH без динамічного відгуку) не дає плавного гасіння удару п'яти й поступового плантарно-дорсального руху, тому маса тіла перекочується через нединамічний важіль і таз із культею виштовхуються догори наприкінці опори. Альтернатива «задовгий протез» дає протилежний за локалізацією симптом — vaulting/циркумдукція у фазі ПЕРЕНОСУ, причому підйом на носок виникає на ЗДОРОВІЙ нозі, а не на протезній."
  },
  "crossCheck": {
    "perSource": [
      {
        "file": "krok-file-2",
        "qId": "krok-file-2-q044",
        "claimedKey": "c",
        "agrees": true,
        "verdict": "correct",
        "reason": "Джерело правильно ідентифікує жорстку стопу як механічну причину порушеного переднього перекату у фазі опори; невпевненість походить лише з конкуренції з варіантом 'довгий протез', який, однак, дає vaulting на здоровій нозі, а не на протезній."
      },
      {
        "file": "krok-file-3",
        "qId": "krok-file-3-q044",
        "claimedKey": "c",
        "agrees": true,
        "verdict": "correct",
        "reason": "Джерело коректно розводить два схожих за назвою феномени за фазою циклу (опора vs перенос) і кінцівкою (протезна vs здорова), що однозначно вказує на жорстку стопу."
      }
    ]
  },
  "finalAnswer": {
    "key": "c",
    "text": "Жорсткий протез стопи",
    "confidence": "high",
    "reasoning": "Незалежне клінічне рішення збігається з обома джерелами. Симптом 'підйом на носок' на самій протезній кінцівці у фазі опори напряму вказує на дистальний компонент, що формує перекат, — стопу протеза. Жорсткий керамічний/дерев'яний кіль або зношений плантарфлексійний бампер блокують амортизацію п'яти й плавний rollover, через що корпус буквально 'підкидає' на носок наприкінці single-limb support. Усі інші варіанти описують проксимальні чи фронтально-площинні дефекти (лордоз, Тренделенбург, vaulting на здоровій нозі, гіперекстензія коліна), що не відповідають сагітальному дефекту переднього перекату на протезі.",
    "agreeingSources": ["krok-file-2", "krok-file-3"],
    "disagreeingSources": []
  },
  "bestWhys": {
    "a": {
      "source": "krok-file-3",
      "angle": "contrast",
      "text": "На відміну від жорсткої стопи, яка прямо обмежує перекат «п'ята–носок», згинальна гільза зміщує центр мас і породжує інші компенсації — лордоз, нерівність кроку, нахил таза.",
      "reason": "Найчіткіше розводить площини й рівні дефекту: проксимальна установка гільзи vs дистальний перекат стопи."
    },
    "b": {
      "source": "krok-file-3",
      "angle": "contrast",
      "text": "Підйом на носок виникає у сагітальній площині, тоді як контрактура абдукторів дає дефекти фронтальної площини — на кшталт Тренделенбурга або широкої постановки протеза.",
      "reason": "Прямо називає площину руху і конкретний клінічний еквівалент абдукторної контрактури (Тренделенбург), що робить виключення варіанту найпереконливішим."
    },
    "c": {
      "source": "krok-file-3",
      "angle": "definitional",
      "text": "Жорстка стопа без амортизації п'яти й обмеженою тильно-підошовною рухливістю не дає плавного перекату: у середині опори таз і колінний шарнір вимушено піднімаються вгору, формуючи дефект підйому на носок.",
      "reason": "Найповніше пояснює механізм: відсутність амортизації + обмежена рухливість стопи → вимушений підйом таза/коліна — це точна біомеханічна причина симптому."
    },
    "d": {
      "source": "krok-file-3",
      "angle": "mnemonic",
      "text": "Орієнтир: довгий протез → проблема в переносі (vaulting/циркумдукція); жорстка стопа → проблема в опорі (підйом на носок протеза).",
      "reason": "Найточніше знімає найпривабливіший дистрактор: відмінність за фазою циклу й стороною (здорова vs протезна) у компактній формі."
    },
    "e": {
      "source": "krok-file-3",
      "angle": "contrast",
      "text": "На відміну від жорсткої стопи, що прямо змінює механіку перекату, слабкість хамстрингів впливає на контроль кукси й коліна, породжуючи зовсім інші дефекти — гіперекстензію коліна чи нахил тулуба назад.",
      "reason": "Розводить рівні впливу (контроль кукси/коліна vs механіка перекату) й називає конкретний клінічний еквівалент слабкості — гіперекстензію коліна."
    }
  },
  "bestHint": {
    "source": "krok-file-3",
    "angle": "attention-marker",
    "text": "Акцент умови — фаза опори на протезі, а не фаза переносу; це звужує коло причин до тих, що формують перекат на самому протезі.",
    "reason": "Найточніше скеровує студента на ключове клінічне розрізнення (опора vs перенос, протезна vs здорова кінцівка), не називаючи правильну відповідь."
  },
  "notes": "Обидва джерела збігаються з незалежним рішенням; первинний прапор 'uncertain' у krok-file-2 знімається — жорстка стопа є стандартною причиною дефекту переднього перекату у фазі опори на протезній стороні."
}