{"uid":"krok-file-2-q024","verifiedAt":"2026-05-20T00:00:00Z","verifiedBy":"claude-opus-4-7","independentChoice":{"key":"d","text":"Істотне обмеження рухової активності, але залишається можливим самостійне пересування","confidence":"high","reasoning":"За модифікованою шкалою Хена-Яра (Hoehn & Yahr) IV стадія канонічно визначається як тяжка інвалідизація з вираженою постуральною нестабільністю, при якій пацієнт усе ще здатний самостійно стояти й ходити без сторонньої допомоги. Повна втрата самостійного пересування (прикутість до крісла колісного чи ліжка) — це вже V стадія. Варіант d дослівно відтворює це формулювання."},"crossCheck":{"perSource":[{"file":"krok-file-2","qId":"krok-file-2-q024","claimedKey":"d","agrees":true,"verdict":"correct","reason":"Джерело правильно ідентифікує IV стадію як істотне обмеження зі збереженою самостійною ходьбою; формулювання відповідає оригінальній шкалі Хена-Яра."},{"file":"krok-file-3","qId":"krok-file-3-q024","claimedKey":"d","agrees":true,"verdict":"correct","reason":"Джерело коректно фіксує водорозділ IV/V саме за критерієм здатності до самостійного пересування."}]},"finalAnswer":{"key":"d","text":"Істотне обмеження рухової активності, але залишається можливим самостійне пересування","confidence":"high","reasoning":"Обидва джерела узгоджено вказують на варіант d, що відповідає канонічному визначенню IV стадії модифікованої шкали Хена-Яра: тяжка інвалідизація з вираженою постуральною нестабільністю при збереженій здатності самостійно стояти й ходити. Решта варіантів описують або сусідні стадії (a — V; b — III; c — I-II), або містять внутрішню суперечність (e — «помірне обмеження» несумісне з «істотною допомогою» й не згадує ключового маркера ходьби). Прапор needsReview у першому джерелі, ймовірно, був помилково виставлений, оскільки modelChosenKey збігається з correctAnswerKey.","agreeingSources":["krok-file-2","krok-file-3"],"disagreeingSources":[]},"bestWhys":{"a":{"source":"krok-file-3","angle":"definitional","text":"Опис відповідає V стадії за Хеном-Яром — пацієнт прикутий до крісла колісного чи ліжка без сторонньої допомоги; це наступний щабель після IV.","reason":"Чітка дефініційна прив'язка до V стадії — найточніший аргумент проти варіанта."},"b":{"source":"krok-file-2","angle":"definitional","text":"Помірне обмеження з лише легкою залежністю в побуті відповідає III стадії шкали Хена-Яра — двобічна симптоматика з постуральною нестабільністю, але збереженою фізичною самостійністю.","reason":"Найточніша дефініційна локалізація опису на III стадії шкали."},"c":{"source":"krok-file-2","angle":"definitional","text":"Легке обмеження без потреби в сторонній допомозі — це опис ранніх I-II стадій шкали Хена-Яра з мінімальними однобічними або двобічними проявами без втрати побутової автономії.","reason":"Прямо ідентифікує клінічний рівень опису (I-II) і пояснює, чому це не IV."},"d":{"source":"krok-file-3","angle":"mnemonic","text":"Орієнтир: IV за Хеном-Яром = «важко, але ще на ногах»; V = «крісло колісне або ліжко». Здатність самостійно пересуватись — ключовий маркер IV проти V.","reason":"Найкомпактніший мнемонічний орієнтир, що фіксує саме той водорозділ, який перевіряє питання."},"e":{"source":"krok-file-3","angle":"definitional","text":"Опис змішує «помірне» обмеження зі «значною» потребою в допомозі — така комбінація не відповідає жодному чіткому щаблю шкали Хена-Яра.","reason":"Найточніше викриває внутрішню суперечність варіанта-дистрактора."}},"bestHint":{"source":"krok-file-2","angle":"framework","text":"Згадай 5-стадійну модифіковану шкалу Хена та Яра — критичний водорозділ між двома останніми сходинками визначається саме здатністю до самостійного пересування.","reason":"Дає правильну рамку (шкала Хена-Яра) і прицільно вказує на критерій IV/V без розкриття формулювання відповіді."},"notes":"Обидва джерела вказують один і той самий ключ (d); прапор needsReview у krok-file-2 виглядає помилковим — фактичної розбіжності між AI та PDF немає."}