{
  "uid": "dup-q027",
  "verifiedAt": "2026-05-20T00:00:00Z",
  "verifiedBy": "claude-opus-4-7",
  "independentChoice": {
    "key": "e",
    "text": "Швидкісно-силові вправи та вправи з невеликим обтяженням",
    "confidence": "high",
    "reasoning": "При артеріальній гіпотензії та НЦД гіпотонічного типу ціль ЛФК — підвищити судинний тонус і АТ через активацію симпатичної ланки. За класичними настановами української/радянської ЛФК-школи (Мухін, Єпіфанов) тонізуючий режим при гіпотонії включає саме швидкісно-силові вправи з невеликим обтяженням, статичні вправи і роботу великих м'язових груп. Дихальні вправи із затримкою на видиху, навпаки, активують парасимпатичну (вагусну) ланку і знижують АТ — це інструмент при гіпертензії, а не гіпотензії."
  },
  "crossCheck": {
    "perSource": [
      {
        "file": "krok-file-2",
        "qId": "krok-file-2-q027",
        "claimedKey": "e",
        "agrees": true,
        "verdict": "correct",
        "reason": "Збігається з класичним протоколом ЛФК при гіпотонії — тонізуючий режим через швидкісно-силові вправи з обтяженням на великі м'язові групи активує симпатику та підвищує АТ."
      },
      {
        "file": "krok-file-3",
        "qId": "krok-file-3-q027",
        "claimedKey": "a",
        "agrees": false,
        "verdict": "incorrect",
        "reason": "Хибна фізіологія: затримка дихання на видиху (на функціональній залишковій ємності) не підвищує внутрішньогрудний тиск, а активує вагус і знижує АТ — це режим для гіпертензії. Аргумент про 'ранню фазу' штучний: умова прямо вказує, що стан вже поліпшився."
      }
    ]
  },
  "finalAnswer": {
    "key": "e",
    "text": "Швидкісно-силові вправи та вправи з невеликим обтяженням",
    "confidence": "high",
    "reasoning": "Канонічна відповідь у Krok 2 «Фізична терапія» для гіпотонічного криза/НЦД гіпотонічного типу у фазі відновлення — тонізуючий режим зі швидкісно-силовими вправами та невеликим обтяженням на середні й великі м'язові групи (Мухін, Єпіфанов). Затримка дихання на видиху має парасимпатичну спрямованість і клінічно протилежна меті лікування. Умова прямо зазначає, що 'стан поліпшився', тож пацієнт уже у фазі активної реабілітації, а не у гострому періоді."
    ,
    "agreeingSources": ["krok-file-2"],
    "disagreeingSources": ["krok-file-3"]
  },
  "bestWhys": {
    "a": {
      "source": "krok-file-2",
      "angle": "mechanism",
      "text": "На видиху падає внутрішньогрудний тиск, активується вагус, ЧСС і АТ знижуються — небажано для пацієнта одразу після гіпотонічного кризу.",
      "reason": "Прямо і коректно пояснює фізіологічний механізм, який робить варіант (a) неправильним при гіпотонії — на противагу хибному обґрунтуванню у file-3."
    },
    "b": {
      "source": "krok-file-2",
      "angle": "mechanism",
      "text": "Без активного скорочення м'язів не вмикається «м'язовий насос» і рефлекторне підвищення периферичного опору, які власне й потрібні для нормалізації АТ при гіпотензії.",
      "reason": "Найточніше показує патофізіологічний дефіцит пасивного режиму саме у контексті потреби підняти АТ."
    },
    "c": {
      "source": "krok-file-2",
      "angle": "definitional",
      "text": "Швидка зміна положення тіла провокує ортостатичну реакцію — у пацієнта після гіпотонічного кризу це загрожує запамороченням, синкопе й повторним падінням АТ.",
      "reason": "Прямо називає клінічний ризик (ортостатичне синкопе), що однозначно виключає варіант у контексті щойно перенесеного гіпотонічного кризу."
    },
    "d": {
      "source": "krok-file-2",
      "angle": "contrast",
      "text": "На відміну від роботи великих м'язів проти опору, дрібно-м'язові вправи не створюють достатнього навантаження для тонізації судинного русла.",
      "reason": "Контраст із правильною відповіддю (e) за ключовою ознакою — об'ємом залученої м'язової маси і опором."
    },
    "e": {
      "source": "krok-file-2",
      "angle": "clinical-context",
      "text": "Це канонічний тонізуючий режим при артеріальній гіпотензії та нейроциркуляторній дистонії гіпотонічного типу у фазі відновлення після кризу.",
      "reason": "Прямо фіксує клінічну канонічність відповіді за класичним ЛФК-протоколом — найкраще обґрунтовує правильність варіанту (e)."
    }
  },
  "bestHint": {
    "source": "krok-file-2",
    "angle": "attention-marker",
    "text": "Ключове слово умови — «гіпотонічний», а не «гіпертонічний»; обирай вправи, що ПІДВИЩУЮТЬ судинний тонус, а не знижують його.",
    "reason": "Знімає головну пастку питання — переплутування гіпо-/гіпер- і випадковий вибір антигіпертензивної дихальної техніки замість тонізуючого режиму."
  },
  "notes": "Override: file-3 містить фізіологічно хибне пояснення (затримка на видиху нібито підвищує внутрішньогрудний тиск і АТ). Канонічна відповідь Krok 2 для гіпотонічного криза у фазі поліпшення — (e)."
}