{"uid":"dup-q066","verifiedAt":"2026-05-20T00:00:00Z","verifiedBy":"claude-opus-4-7","independentChoice":{"key":"e","text":"Тривале статичне розтягнення","confidence":"high","reasoning":"Питання обмежує вибір рамкою «втручання ерготерапії», що виключає ботулінотерапію як медичну ін'єкційну процедуру лікаря. При спастичності Ашворт 3-4 з больовим синдромом тривале низькоінтенсивне статичне розтягнення активує сухожилкові органи Гольджі та Ib-аференти з автогенним гальмуванням альфа-мотонейрона, плюс в'язкоеластичний creep тканин. Вібрація через Ia-аференти веретен посилює міотатичний рефлекс і протипоказана; тепло й ортез — допоміжні методи, що не знижують тонус самостійно."},"crossCheck":{"perSource":[{"file":"krok-file-2","qId":"krok-file-2-q066","claimedKey":"e","agrees":true,"verdict":"correct","reason":"Збігається з незалежним вердиктом: тривале статичне розтягнення — базове ерготерапевтичне втручання при тяжкій спастичності з болем."},{"file":"krok-file-3","qId":"krok-file-3-q066","claimedKey":"e","agrees":true,"verdict":"correct","reason":"Збігається з незалежним вердиктом і коректно описує механізм автогенного гальмування через органи Гольджі."}]},"finalAnswer":{"key":"e","text":"Тривале статичне розтягнення","confidence":"high","reasoning":"Обидва джерела узгоджуються з незалежним клінічним рішенням. Питання прямо звужене до ерготерапевтичної рамки (виключає ботулінотерапію), а серед немедикаментозних методів лише тривале статичне розтягнення активно знижує тонус через активацію Ib-аферентів сухожилкових органів Гольджі та в'язкоеластичну адаптацію саркомерів. Вібрація потенційно посилює спастичність, тепло й ортез — лише підготовчі/утримуючі методи. Незначна текстова різниця між джерелами (з/без «м'язів») не впливає на клінічний зміст.","agreeingSources":["krok-file-2","krok-file-3"],"disagreeingSources":[]},"bestWhys":{"a":{"source":"krok-file-3","angle":"mechanism","text":"Вібрація активує Ia-аференти веретен і посилює моносинаптичний міотатичний рефлекс, тобто збільшує спастичність, а не зменшує її.","reason":"Найбільш дискримінативне нейрофізіологічне пояснення, чому вібрація шкодить при високому тонусі."},"b":{"source":"krok-file-3","angle":"contrast","text":"Клінічно ботулотоксин справді ефективний при фокальній спастичності 3-4, але умова прямо запитує саме про ерготерапевтичне втручання, тож відповідь у межах немедикаментозних методів ОТ.","reason":"Чесно визнає клінічну ефективність ботулотоксину й чітко вказує на пастку рамки ерготерапії."},"c":{"source":"krok-file-3","angle":"contrast","text":"На відміну від тривалого розтягнення, що активно знижує тонус через нейром'язові механізми, ортезування лише пасивно утримує положення й логічно йде після зниження тонусу, а не замість нього.","reason":"Чітко розводить функції ортезу та розтягнення — ключовий критерій вибору в цьому питанні."},"d":{"source":"krok-file-3","angle":"contrast","text":"На відміну від тривалого розтягнення зі стійким нейрофізіологічним ефектом, тепло діє поверхнево й тимчасово; до того ж постінсультні порушення чутливості роблять його небезпечним.","reason":"Поєднує два ключових мінуси теплових процедур саме в постінсультному контексті — короткочасність і сенсорний ризик."},"e":{"source":"krok-file-3","angle":"mechanism","text":"Тривалий статичний інпут активує органи Гольджі та Ib-аференти, запускаючи автогенне гальмування мотонейрона; додатково діє ефект м'язового creep — в'язкоеластична релаксація волокон.","reason":"Найповніше пояснює нейрофізіологічний і біомеханічний механізм, що робить саме цей метод ефективним при Ашворті 3-4."}},"bestHint":{"source":"krok-file-3","angle":"clinical-pattern","text":"При Ашворті 3-4 з болем стимулюючі методи (вібрація, тепло) лише підсилять тонус; обирай немедикаментозний метод гальмування, доступний у роботі ерготерапевта.","reason":"Одночасно відсіює два хибні варіанти і задає рамку «ерготерапевтичний, гальмівний» без розкриття самого методу."},"notes":"Обидва джерела повністю узгоджені; cross_file_mismatch стосується лише формулювання тексту варіанту e (з/без слова «м'язів»), без клінічного розходження."}