{
  "uid": "dup-q085",
  "verifiedAt": "2026-05-20T00:00:00Z",
  "verifiedBy": "claude-opus-4-7",
  "independentChoice": {
    "key": "b",
    "text": "Участь",
    "confidence": "medium",
    "reasoning": "У WHO ICF Major Life Areas (Розділ 8 d-кодів) формально містять Education (d810–d839) та Work and employment (d840–d859) — тобто роботу й навчання класифіковано саме в компоненті Activities and Participation. Теперішній час «Я працюю..., навчаюся...» описує актуальну залученість у життєві ситуації, що відповідає дефініції Participation («involvement in a life situation»). Особистісні фактори в МКФ — це демографія, риси характеру, стиль життя, минулий досвід; вони свідомо не класифіковані в ICF, і саме поточне виконання ролей працівника/студента туди не зараховують."
  },
  "crossCheck": {
    "perSource": [
      {
        "file": "krok-file-2",
        "qId": "krok-file-2-q085",
        "claimedKey": "b",
        "agrees": true,
        "verdict": "correct",
        "reason": "Узгоджується з формальною класифікацією WHO ICF: робота (d845–d850) та освіта (d820–d825) належать до Activities and Participation, а не до Особистісних факторів. Опис ролей бібліотекарки і студентки = залученість у life situations."
      },
      {
        "file": "krok-file-3",
        "qId": "krok-file-3-q085",
        "claimedKey": "e",
        "agrees": false,
        "verdict": "incorrect",
        "reason": "Аргумент «біографічний портрет» суперечить формальній структурі МКФ: робота й навчання мають власні d-коди в Розділі 8 (Major Life Areas) і належать до Участі. Особистісні фактори охоплюють вік, стать, характер, стиль життя — а не сам факт зайнятості/освіти, який є типовим прикладом Participation у Posici документації WHO."
      }
    ]
  },
  "finalAnswer": {
    "key": "b",
    "text": "Участь",
    "confidence": "medium",
    "reasoning": "Формальна WHO ICF класифікація однозначно розміщує роботу (d845 Acquiring, keeping and terminating a job; d850 Remunerative employment) та освіту (d820 School education; d825 Vocational training) у компоненті Activities and Participation, Розділ 8 «Major Life Areas». Теперішнє «працюю бібліотекаркою + навчаюся на курсах» = поточна залученість у життєві ситуації, тобто Participation. Особистісні фактори в МКФ свідомо не класифіковані й охоплюють демографію та внутрішні риси, а не саме виконання соціальних ролей. Confidence — medium, оскільки в окремих українських ерготерапевтичних посібниках біографічну самопрезентацію при інтерв'ю іноді відносять до особистісних факторів; однак з погляду офіційної WHO ICF та її україномовного перекладу МОЗ — це Участь.",
    "agreeingSources": ["krok-file-2"],
    "disagreeingSources": ["krok-file-3"]
  },
  "bestWhys": {
    "a": {
      "source": "krok-file-2",
      "angle": "contrast",
      "text": "На відміну від «Участі», яка відображає залученість у життєві ситуації (робота, навчання), «Функції» — це базовий рівень тіла. Бібліотекарка-студентка описує життєві ролі, а не функції організму.",
      "reason": "Прямий контраст із правильним доменом (Участь) пояснює, чому біографічна інформація не має стосунку до фізіологічних функцій тіла."
    },
    "b": {
      "source": "krok-file-2",
      "angle": "definitional",
      "text": "У МКФ «Участь» — це залученість людини в життєві ситуації: оплачувана робота, освіта, сімейні та громадські ролі. Праця бібліотекаркою й навчання на курсах — типові приклади саме цього домену.",
      "reason": "Дефініційний кандидат прямо цитує визначення Participation та зразу прив'язує його до фрази з умови — найкоротший шлях до розуміння, чому це саме Участь."
    },
    "c": {
      "source": "krok-file-2",
      "angle": "contrast",
      "text": "Активність і Участь поділяють один перелік доменів МКФ, але різняться масштабом: Активність — задача (читати), Участь — життєва ситуація (бути працівником бібліотеки). У питанні йдеться про роль, тому правильна — Участь.",
      "reason": "Активність — найближчий дистрактор до Участі (спільний перелік d-кодів); явне розмежування «задача vs життєва ситуація» — критичний дискримінатор."
    },
    "d": {
      "source": "krok-file-2",
      "angle": "contrast",
      "text": "На відміну від «Участі», яка стосується самого пацієнта і його залученості, «Фактори середовища» характеризують зовнішнє оточення — будівлю бібліотеки, колег, наявність ліфта тощо. У відповіді таких ознак немає.",
      "reason": "Контраст «оточення vs сама людина» прямо показує, чому опис власної професії не є описом середовища."
    },
    "e": {
      "source": "krok-file-2",
      "angle": "contrast",
      "text": "Особистісні фактори — це хто людина є за своїми сталими рисами (стать, вік, темперамент), а Участь — що вона робить у суспільстві. Бути бібліотекаркою — це роль, а не риса.",
      "reason": "Цей контраст безпосередньо адресує конкуруючу інтерпретацію (е), яка є найслабшою лінією плутанини: розмежовує «риса особистості» від «соціальна роль»."
    }
  },
  "bestHint": {
    "source": "krok-file-2",
    "angle": "framework",
    "text": "У МКФ є два суміжні домени з одним переліком категорій, що відрізняються масштабом: задача vs життєва ситуація. Згадай, який із них охоплює роботу й освіту.",
    "reason": "Спрямовує мислення на ключову пару Activity/Participation у МКФ, де роботу й освіту класифіковано саме як Major Life Areas (Участь), без розкриття відповіді."
  },
  "notes": "Питання має реальну клінічну неоднозначність: формальна WHO ICF класифікує роботу/освіту в d-кодах (Участь), однак частина українських ерготерапевтичних джерел трактує самопрезентацію при інтерв'ю як Особистісні фактори. Обрано Участь як відповідь, що відповідає офіційній структурі ICF та україномовному перекладу МОЗ."
}