{"uid":"krok-file-2-q147","verifiedAt":"2026-05-20T00:00:00Z","verifiedBy":"claude-opus-4-7","independentChoice":{"key":"b","text":"Зменшенню частоти серцевих скорочень і розширенню коронарних артерій","confidence":"high","reasoning":"Стовбур питання прямо формулює дві задачі реабілітації при ІХС: зниження потреби міокарда в кисні та адекватна доставка О₂. Тренувальний ефект аеробних навантажень реалізується через підвищення парасимпатичного тонусу (брадикардія спокою — менша робота серця + довша діастола) та ендотелій-залежну коронарну вазодилатацію (через NO). Лише варіант b одночасно задовольняє обидва компоненти балансу «потреба–доставка». Це канонічна формула «ефекту тренованого серця» в кардіореабілітації за моделлю ВООЗ."},"crossCheck":{"perSource":[{"file":"krok-file-2","qId":"krok-file-2-q147","claimedKey":"b","agrees":true,"verdict":"correct","reason":"Джерело правильно ідентифікує тренувальну брадикардію + коронарну вазодилатацію як двокомпонентну реалізацію мети, заявленої у стовбурі питання."},{"file":"krok-file-3","qId":"krok-file-3-q147","claimedKey":"b","agrees":true,"verdict":"correct","reason":"Джерело коректно описує механізм через парасимпатичний тонус, NO-залежну вазодилатацію та подовження діастоли — повністю відповідає стандартній концепції кардіореабілітації при ІХС."}]},"finalAnswer":{"key":"b","text":"Зменшенню частоти серцевих скорочень і розширенню коронарних артерій","confidence":"high","reasoning":"Незалежне клінічне рішення повністю збігається з обома джерелами. Сприятливий вплив систематичних фізичних навантажень при ІХС реалізується через два синергічні механізми: тренувальну брадикардію спокою (↓потреба міокарда в О₂ через меншу роботу серця і подовження діастолічної фази коронарної перфузії) та ендотелій-залежну коронарну вазодилатацію (↑доставка О₂). Лише варіант b містить обидва компоненти, що відповідають двом задачам, явно сформульованим у стовбурі. Прапор needsReview у валідації обох джерел стосується розбіжності з PDF (де нібито правильний варіант d), а не з клінічною істиною — клінічно правильна відповідь однозначно b.","agreeingSources":["krok-file-2","krok-file-3"],"disagreeingSources":[]},"bestWhys":{"a":{"source":"krok-file-3","angle":"contrast","text":"На відміну від правильної відповіді, тут одна частина (розширення коронарних) допомагає, а друга (↑АТ) погіршує баланс «потреба–доставка»; для сприятливого ефекту мають збігатися обидва компоненти.","reason":"Найточніше пояснює суть пастки — «половинна правда» не дає сприятливого ефекту, що прямо випливає з двокомпонентної мети у стовбурі."},"b":{"source":"krok-file-3","angle":"mnemonic","text":"Орієнтир: «повільніше б'ється, ширше живиться» — ↓ЧСС + розширення коронарних — єдина пара, де обидва компоненти одночасно полегшують роботу ішемізованого серця.","reason":"Лаконічна мнемоніка прямо склеює обидва механізми (↓потреба + ↑доставка) у запам'ятовуване правило, що відповідає двом задачам стовбура."},"c":{"source":"krok-file-2","angle":"mechanism","text":"Коронарна вазоконстрикція зменшує перфузію і провокує ішемію — це механізм нападу стенокардії, а не тренувального ефекту; ефективна реабілітація прагне протилежного — поліпшення ендотелій-залежної дилатації.","reason":"Найясніше виокремлює клінічну несумісність вазоконстрикції з метою реабілітації при ІХС."},"d":{"source":"krok-file-3","angle":"contrast","text":"Цей варіант — пряма протилежність правильному: там «↓ЧСС + розширення», тут «↑АТ + звуження»; легко виключити перевіркою «обидва компоненти мають допомагати міокарду».","reason":"Найшвидший спосіб дискваліфікувати дзеркальний дистрактор через прямий контраст з правильною відповіддю."},"e":{"source":"krok-file-2","angle":"contrast","text":"Це «майже-правильний» дистрактор: половина відповіді (дилатація коронарів) збігається, але замість тренувальної брадикардії стоїть тахікардія — антагоніст мети реабілітації.","reason":"Чітко ловить пастку дистрактора, де одна половина правильна, а друга антагоністична — саме це має розпізнати студент."}},"bestHint":{"source":"krok-file-3","angle":"mechanism","text":"Думай рівнянням балансу: потреба міокарда в О₂ має ↓ через нижчий ЧСС/АТ, доставка — ↑ через ширші коронарні; який варіант не суперечить ЖОДНІЙ із двох частин?","reason":"Найрозрізняльніший — змушує перевірити одразу обидві частини варіанта через стовбурове «потреба–доставка», не називаючи відповіді."},"notes":"Обидва джерела містять needsReview=true через розбіжність з PDF, але клінічно правильна відповідь b підтверджена незалежним рішенням і обома enriched-джерелами; це випадок типу ai_disagrees_pdf, де AI-override обґрунтований."}