{
  "uid": "krok-file-3-q067",
  "verifiedAt": "2026-05-20T00:00:00Z",
  "verifiedBy": "claude-opus-4-7",
  "independentChoice": {
    "key": "a",
    "text": "«Встань та йди»",
    "confidence": "high",
    "reasoning": "Тест «Встань та йди» (Timed Up and Go, TUG) — стандартизований інструмент саме для оцінки функціональної мобільності й ризику падінь у літніх пацієнтів, у т.ч. пострінсультних. Він інтегрує підйом зі стільця, ходу на 3 м, розворот і повернення, виконується за <1 хв, потребує лише стільця та секундоміра. Час ≥13,5 с є валідованим маркером підвищеного ризику падінь (Podsiadlo & Richardson, 1991; AGS/BGS Falls Guidelines)."
  },
  "crossCheck": {
    "perSource": [
      {
        "file": "krok-file-3",
        "qId": "krok-file-3-q067",
        "claimedKey": "a",
        "agrees": true,
        "verdict": "correct",
        "reason": "TUG — канонічна експрес-проба функціональної мобільності та ризику падінь, що відповідає всім критеріям умови (без обладнання, швидко, інтегральна оцінка). Reasoning і доказова база у джерелі коректні."
      }
    ]
  },
  "finalAnswer": {
    "key": "a",
    "text": "«Встань та йди»",
    "confidence": "high",
    "reasoning": "Умова вимагає одну коротку пробу, що одночасно вимірює функціональну мобільність і ризик падінь, без спецобладнання і за короткий час — це точний клінічний профіль TUG. 10MWT оцінює лише швидкість ходи; 2MWT — аеробну витривалість; DGI потребує конусів, коробки й сходів; BBS — це 14-пунктова шкала на 15–20 хв з реквізитом. Незалежне рішення і джерело збігаються; флаг ai_disagrees_pdf тут підтверджує правильний AI-override (PDF, ймовірно, мав інший ключ).",
    "agreeingSources": ["krok-file-3"],
    "disagreeingSources": []
  },
  "bestWhys": {
    "a": {
      "source": "krok-file-3",
      "angle": "definitional",
      "text": "TUG послідовно вимірює підйом зі стільця, ходу 3 м, розворот і повернення; за конструкцією це інтегральна проба функціональної мобільності з прицілом саме на ризик падінь.",
      "reason": "Прямо відповідає на «чому саме TUG» — описує конструкцію тесту як інтегральну пробу мобільності й падінь, що дослівно збігається з критеріями умови."
    },
    "b": {
      "source": "krok-file-3",
      "angle": "contrast",
      "text": "На відміну від TUG, DGI потребує конусів, коробки й сходів, а також триває довше, тож не відповідає вимозі «без спецобладнання й небагато часу».",
      "reason": "Найточніше відсіює DGI саме за критеріями умови (обладнання й час), а не за абстрактною характеристикою."
    },
    "c": {
      "source": "krok-file-3",
      "angle": "definitional",
      "text": "2MWT — субмаксимальна проба аеробної витривалості: пацієнт іде 2 хв, оцінюється пройдена дистанція; це не інструмент оцінки функціональної мобільності й падінь.",
      "reason": "Чітко вказує домен 2MWT (витривалість), що відсікає його від домену запиту (мобільність + падіння)."
    },
    "d": {
      "source": "krok-file-3",
      "angle": "contrast",
      "text": "На відміну від TUG, BBS потребує стільця, лінійки, сходинки й близько 15–20 хвилин, тож суперечить вимозі «мало часу й без обладнання».",
      "reason": "Прямо відсіює BBS за двома експліцитними критеріями умови — часом і реквізитом."
    },
    "e": {
      "source": "krok-file-3",
      "angle": "contrast",
      "text": "На відміну від TUG, 10MWT не містить трансферу сидячи-стоячи й повороту — а саме ці фази є типовими тригерами падінь у пострінсультних пацієнтів.",
      "reason": "Найсильніше клінічне спростування основного дистрактора: пояснює, чому одна швидкість ходи недостатня для оцінки ризику падінь."
    }
  },
  "bestHint": {
    "source": "krok-file-3",
    "angle": "attention-marker",
    "text": "Акценти умови — «функціональна рухливість» І «ризик падінь» одночасно, без спецобладнання й за короткий час; одна проба має закрити обидва завдання.",
    "reason": "Витягує з умови подвійний критерій (мобільність + падіння) і обмеження (час, обладнання), не розкриваючи відповіді, але звужуючи пошук до інтегральної експрес-проби."
  },
  "notes": "Флаг ai_disagrees_pdf тут — приклад валідного AI-override: TUG однозначно відповідає всім чотирьом критеріям умови (мобільність, падіння, без обладнання, швидко)."
}