{"uid":"krok-file-2-q106","verifiedAt":"2026-05-20T00:00:00Z","verifiedBy":"claude-opus-4-7","independentChoice":{"key":"e","text":"3,5-5","confidence":"high","reasoning":"Тест Отта оцінює рухливість грудного відділу хребта: від остистого відростка C7 відмірюють 30 см донизу, після чого пацієнт виконує максимальний нахил уперед. У здорової дорослої людини відстань між цими позначками при флексії збільшується приблизно на 3,5–5 см (близько 4 см). Це стандартний референс у мануальному обстеженні та ревматології; інші варіанти або відповідають патологічному обмеженню (0,5–3; 1–2 см), або належать іншим тестам/відділам (7–10; 8–9,5 см)."},"crossCheck":{"perSource":[{"file":"krok-file-2","qId":"krok-file-2-q106","claimedKey":"e","agrees":true,"verdict":"correct","reason":"Джерело правильно ідентифікує норму приросту 3,5–5 см для тесту Отта на грудний відділ при флексії."},{"file":"krok-file-3","qId":"krok-file-3-q106","claimedKey":"e","agrees":true,"verdict":"correct","reason":"Джерело правильно вказує діапазон 3,5–5 см як норму приросту при флексії в тесті Отта; додатково розводить його з нормою екстензії (1–2 см) та тестом Шобера."}]},"finalAnswer":{"key":"e","text":"3,5-5","confidence":"high","reasoning":"Незалежне клінічне рішення збігається з обома джерелами: тест Отта (C7 + 30 см вниз) при максимальній флексії грудного відділу у здорового дорослого дає приріст відстані 3,5–5 см. Це класичний референс, що використовується для скринінгу обмежень рухливості грудного відділу (посттравматичних, при спондилоартропатіях). Решта варіантів логічно виключаються: 0,5–3 і 1–2 см — це показники обмеженої рухливості (або норми екстензії), а 7–10 і 8–9,5 см фізіологічно недосяжні для грудного відділу через реберний каркас і відповідають іншим тестам/відділам.","agreeingSources":["krok-file-2","krok-file-3"],"disagreeingSources":[]},"bestWhys":{"a":{"source":"krok-file-3","angle":"contrast","text":"На відміну від правильного 3,5–5 см, 7–10 см — це навіть більше за приріст у тесті Шобера для поперекового відділу; плутання з поперековою нормою — типова пастка цього питання.","reason":"Найточніше викриває механізм пастки — плутання норми Отта з поперековою нормою Шобера, плюс підкреслює, що 7–10 см перевищує навіть Шобера."},"b":{"source":"krok-file-3","angle":"contrast","text":"Норма Отта 3,5–5 см вдвічі менша за цей варіант; число 8–9,5 — це підставлений «великий» дистрактор, аби перевірити, чи плутає студент норму з гіпермобільністю.","reason":"Чітке кількісне зіставлення з нормою та пояснення дидактичного задуму дистрактора."},"c":{"source":"krok-file-3","angle":"clinical-context","text":"0,5–3 см зустрічаються у пацієнтів з анкілозуючим спондилітом, остеохондрозом чи післятравматичною ригідністю — саме там, де норму Отта вже втрачено.","reason":"Прив'язує діапазон до конкретних клінічних станів (включно з посттравматичною ригідністю, релевантною умові питання)."},"d":{"source":"krok-file-3","angle":"mnemonic","text":"Орієнтир: «Отт: флексія +3,5–5 см, екстензія –1–2 см»; коли бачиш у варіантах одиниці-двійки — перевір, чи питають про згинання.","reason":"Найточніше пояснення: 1–2 см — це норма екстензії за Оттом, а не патологія; компактне правило одночасно закриває пастку напрямку руху."},"e":{"source":"krok-file-3","angle":"mnemonic","text":"Запам'ятай: «Отт — 30 см вниз від C7, нормальний приріст 3,5–5 см при флексії»; число 30 → діапазон 3,5–5 як орієнтовно «десята частина» базового відрізка.","reason":"Поєднує методику (30 см від C7) з нормою (3,5–5 см) і додає мнемонічне правило «десятої частини» — найповніший та найкраще запам'ятовуваний кандидат."}},"bestHint":{"source":"krok-file-3","angle":"framework","text":"Згадай парну рамку: Шобер — поперековий відділ із приростом близько 5 см, Отт — грудний; питання про «грудний + флексія».","reason":"Парна рамка Шобер↔Отт із явним акцентом на «грудний + флексія» найшвидше виводить на правильний діапазон, не розкриваючи саме число."},"notes":"Обидва джерела узгоджені; примітка з krok-file-3 про ширший міжнародний діапазон (2–4 см) не змінює вибору, бо серед запропонованих варіантів лише 3,5–5 см є фізіологічно адекватним."}